{
  "schema_version": 1,
  "hubs": [
    {
      "id": "hub.lantern_halls_01",
      "schema_version": 1,
      "enabled": true,
      "earliest_release_stage": "core",
      "localization_name_key": "hub.lantern_halls_01.name",
      "localization_description_key": "hub.lantern_halls_01.description",
      "asset_ids": ["tilemap.hub.lantern_halls_01"],
      "tags": ["hub", "safe", "noncombat"],
      "source_document_feature_id": "CONT-HUB-001",
      "width_tiles": 64,
      "height_tiles": 48,
      "origin": "northwest",
      "solid_shell_tiles": 1,
      "player_radius_milli_tiles": 300,
      "minimum_aisle_width_milli_tiles": 3000,
      "safe_noncombat": true,
      "default_spawn": {"x": 32000, "y": 42000},
      "character_select_return": {"x": 32000, "y": 44000},
      "solid_rectangles": [
        {"x": 6000, "y": 35000, "width": 12000, "height": 2000},
        {"x": 46000, "y": 35000, "width": 12000, "height": 2000},
        {"x": 6000, "y": 7000, "width": 14000, "height": 2000},
        {"x": 44000, "y": 7000, "width": 14000, "height": 2000},
        {"x": 29000, "y": 22000, "width": 6000, "height": 4000}
      ],
      "prohibited_creation": ["hostile", "damage", "projectile", "pickup", "drop"],
      "object_ids": [
        "spawn.hub.character_select_return",
        "station.memorial_wall",
        "station.oath_shrine",
        "station.overflow",
        "station.realm_gate",
        "station.vault"
      ]
    }
  ],
  "worlds": [
    {
      "id": "world.core_microrealm_01",
      "schema_version": 1,
      "enabled": true,
      "earliest_release_stage": "core",
      "localization_name_key": "world.core_microrealm_01.name",
      "localization_description_key": "world.core_microrealm_01.description",
      "asset_ids": ["tilemap.world.core_microrealm_01"],
      "tags": ["world", "danger", "core_microrealm"],
      "source_document_feature_id": "CONT-WORLD-001",
      "width_tiles": 48,
      "height_tiles": 48,
      "origin": "northwest",
      "solid_shell_tiles": 1,
      "base_terrain": "clear_mud",
      "capacity": 1,
      "disabled_systems": ["macro_scheduler", "realm_cycle", "siege", "retirement"],
      "realm_gate": {"x": 4000, "y": 38000, "width": 10000, "height": 10000},
      "player_spawn": {"x": 8500, "y": 40500},
      "lantern_fork_safe_area": {"center": {"x": 24500, "y": 24500}, "radius": 5000},
      "bell_portal_area": {"center": {"x": 40500, "y": 8500}, "radius": 3000},
      "roads": [
        {
          "width_milli_tiles": 5000,
          "points": [
            {"x": 8500, "y": 40500},
            {"x": 24500, "y": 40500},
            {"x": 24500, "y": 24500},
            {"x": 40500, "y": 24500},
            {"x": 40500, "y": 8500}
          ]
        }
      ],
      "candidate_spawn_anchors": [
        {"x": 8500, "y": 8500},
        {"x": 16500, "y": 8500},
        {"x": 24500, "y": 8500},
        {"x": 8500, "y": 16500},
        {"x": 16500, "y": 16500},
        {"x": 32500, "y": 16500},
        {"x": 8500, "y": 24500},
        {"x": 16500, "y": 32500},
        {"x": 32500, "y": 32500}
      ],
      "intentionally_excluded_anchor": {"x": 32500, "y": 24500},
      "enabled_spawn_anchor_count": 8,
      "object_ids": [
        "landmark.lantern_fork",
        "landmark.realm_gate",
        "portal.dungeon.bell_sepulcher",
        "portal.return.lantern_halls"
      ]
    }
  ],
  "objects": [
    {
      "id": "landmark.lantern_fork",
      "schema_version": 1,
      "enabled": true,
      "earliest_release_stage": "core",
      "localization_name_key": "landmark.lantern_fork.name",
      "localization_description_key": "landmark.lantern_fork.description",
      "asset_ids": ["sprite.landmark.lantern_fork"],
      "tags": ["landmark", "safe_zone"],
      "source_document_feature_id": "CONT-WORLD-001",
      "parent_id": "world.core_microrealm_01",
      "geometry": {"object_kind": "circle_landmark", "circle": {"center": {"x": 24500, "y": 24500}, "radius": 5000}},
      "authored_core_enabled": true,
      "integration_gate": null
    },
    {
      "id": "landmark.realm_gate",
      "schema_version": 1,
      "enabled": true,
      "earliest_release_stage": "core",
      "localization_name_key": "landmark.realm_gate.name",
      "localization_description_key": "landmark.realm_gate.description",
      "asset_ids": ["sprite.landmark.realm_gate"],
      "tags": ["landmark", "realm_entry"],
      "source_document_feature_id": "CONT-WORLD-001",
      "parent_id": "world.core_microrealm_01",
      "geometry": {"object_kind": "rectangle_landmark", "rectangle": {"x": 4000, "y": 38000, "width": 10000, "height": 10000}},
      "authored_core_enabled": true,
      "integration_gate": null
    },
    {
      "id": "portal.dungeon.bell_sepulcher",
      "schema_version": 1,
      "enabled": true,
      "earliest_release_stage": "core",
      "localization_name_key": "portal.dungeon.bell_sepulcher.name",
      "localization_description_key": "portal.dungeon.bell_sepulcher.description",
      "asset_ids": ["sprite.portal.dungeon.bell_sepulcher"],
      "tags": ["portal", "dungeon_entry", "requires_microrealm_cleared"],
      "source_document_feature_id": "CONT-WORLD-001",
      "parent_id": "world.core_microrealm_01",
      "geometry": {"object_kind": "circle_portal", "circle": {"center": {"x": 40500, "y": 8500}, "radius": 3000}},
      "authored_core_enabled": true,
      "integration_gate": "core_world_flow_integration"
    },
    {
      "id": "portal.return.lantern_halls",
      "schema_version": 1,
      "enabled": true,
      "earliest_release_stage": "core",
      "localization_name_key": "portal.return.lantern_halls.name",
      "localization_description_key": "portal.return.lantern_halls.description",
      "asset_ids": ["sprite.portal.return.lantern_halls"],
      "tags": ["portal", "hall_return", "safe_transfer"],
      "source_document_feature_id": "CONT-WORLD-001",
      "parent_id": "world.core_microrealm_01",
      "geometry": {"object_kind": "rectangle_portal", "rectangle": {"x": 4000, "y": 38000, "width": 10000, "height": 10000}},
      "authored_core_enabled": true,
      "integration_gate": "core_world_flow_integration"
    },
    {
      "id": "spawn.hub.character_select_return",
      "schema_version": 1,
      "enabled": true,
      "earliest_release_stage": "core",
      "localization_name_key": "spawn.hub.character_select_return.name",
      "localization_description_key": "spawn.hub.character_select_return.description",
      "asset_ids": [],
      "tags": ["spawn_anchor", "nonvisual", "character_select_return"],
      "source_document_feature_id": "CONT-HUB-001",
      "parent_id": "hub.lantern_halls_01",
      "geometry": {"object_kind": "spawn_anchor", "point": {"x": 32000, "y": 44000}},
      "authored_core_enabled": true,
      "integration_gate": null
    },
    {
      "id": "station.memorial_wall",
      "schema_version": 1,
      "enabled": true,
      "earliest_release_stage": "core",
      "localization_name_key": "station.memorial_wall.name",
      "localization_description_key": "station.memorial_wall.description",
      "asset_ids": ["sprite.station.memorial_wall"],
      "tags": ["station"],
      "source_document_feature_id": "CONT-HUB-001",
      "parent_id": "hub.lantern_halls_01",
      "geometry": {"object_kind": "point_interactable", "point": {"x": 10000, "y": 10000}, "clear_radius_milli_tiles": 2000},
      "authored_core_enabled": true,
      "integration_gate": "core_world_flow_integration"
    },
    {
      "id": "station.oath_shrine",
      "schema_version": 1,
      "enabled": true,
      "earliest_release_stage": "core",
      "localization_name_key": "station.oath_shrine.name",
      "localization_description_key": "station.oath_shrine.description",
      "asset_ids": ["sprite.station.oath_shrine"],
      "tags": ["station"],
      "source_document_feature_id": "CONT-HUB-001",
      "parent_id": "hub.lantern_halls_01",
      "geometry": {"object_kind": "point_interactable", "point": {"x": 24000, "y": 18000}, "clear_radius_milli_tiles": 2000},
      "authored_core_enabled": true,
      "integration_gate": "core_world_flow_integration"
    },
    {
      "id": "station.overflow",
      "schema_version": 1,
      "enabled": true,
      "earliest_release_stage": "core",
      "localization_name_key": "station.overflow.name",
      "localization_description_key": "station.overflow.description",
      "asset_ids": ["sprite.station.overflow"],
      "tags": ["station"],
      "source_document_feature_id": "CONT-HUB-001",
      "parent_id": "hub.lantern_halls_01",
      "geometry": {"object_kind": "point_interactable", "point": {"x": 15000, "y": 38000}, "clear_radius_milli_tiles": 2000},
      "authored_core_enabled": true,
      "integration_gate": "core_world_flow_integration"
    },
    {
      "id": "station.realm_gate",
      "schema_version": 1,
      "enabled": true,
      "earliest_release_stage": "core",
      "localization_name_key": "station.realm_gate.name",
      "localization_description_key": "station.realm_gate.description",
      "asset_ids": ["sprite.station.realm_gate"],
      "tags": ["station", "realm_entry", "instant_interaction"],
      "source_document_feature_id": "CONT-HUB-001",
      "parent_id": "hub.lantern_halls_01",
      "geometry": {"object_kind": "point_interactable", "point": {"x": 32000, "y": 3000}, "clear_radius_milli_tiles": 2000},
      "authored_core_enabled": true,
      "integration_gate": "core_world_flow_integration"
    },
    {
      "id": "station.vault",
      "schema_version": 1,
      "enabled": true,
      "earliest_release_stage": "core",
      "localization_name_key": "station.vault.name",
      "localization_description_key": "station.vault.description",
      "asset_ids": ["sprite.station.vault"],
      "tags": ["station"],
      "source_document_feature_id": "CONT-HUB-001",
      "parent_id": "hub.lantern_halls_01",